{
  "schema_version": "0.1.0-candidate",
  "receipt_id": "mcp-adm-001",
  "tool_name": "get_model",
  "server_name": "@hummbl/mcp-server",
  "version_or_ref": "1.2.0",
  "owner": "hummbl-dev",
  "transport": "stdio",
  "authentication_required": false,
  "authorization_model": "local_only",
  "command_surface": ["get_model"],
  "network_access": "none",
  "filesystem_access": "read",
  "secret_access": "none",
  "sandbox_posture": "host",
  "logging_and_receipts": true,
  "revocation_path": "disable in client config",
  "known_risks": ["reads local model data only"],
  "allowed_scopes": ["base120:read"],
  "disabled_by_default_commands": [],
  "admission_decision": "admit",
  "reviewer": "operator",
  "evidence_pointers": ["src/tools/models.ts", "src/data/base120_models.json"],
  "do_not_infer": [
    "does not imply all MCP tools are safe",
    "does not imply permanent trust",
    "admission is scoped and revocable"
  ],
  "timestamp": "2026-07-01T00:00:00Z"
}
