{
  "schema_version": "0.1.0-candidate",
  "receipt_id": "mcp-adm-003",
  "tool_name": "export_models",
  "server_name": "@hummbl/mcp-server",
  "version_or_ref": "1.2.0",
  "owner": "hummbl-dev",
  "transport": "stdio",
  "authentication_required": false,
  "authorization_model": "local_only",
  "command_surface": ["export_models"],
  "network_access": "none",
  "filesystem_access": "write",
  "secret_access": "none",
  "sandbox_posture": "host",
  "logging_and_receipts": true,
  "revocation_path": "disable in client config",
  "known_risks": ["writes to local filesystem"],
  "allowed_scopes": ["base120:export"],
  "disabled_by_default_commands": [],
  "admission_decision": "admit_with_scope",
  "reviewer": "operator",
  "evidence_pointers": ["src/tools/export.ts"],
  "do_not_infer": [
    "admission is scoped to base120:export only",
    "does not imply all export operations are safe",
    "admission is revocable"
  ],
  "timestamp": "2026-07-01T00:02:00Z"
}
